{
  "$schema": "https://json-schema.org/draft/2020-12/schema",
  "$id": "https://github.com/TransactionTree/transactiontree-schemas/blob/main/customfield/1.0/Group/searchGroupField/searchGroupField-response.schema.json",
  "title": "searchGroupField response (success)",
  "description": "Success reply (response_code 'S200'). Any call may instead return the error envelope (see common.schema.json#/$defs/ErrorResponse and the family README error table).",
  "type": "object",
  "allOf": [
    {
      "$ref": "../../common.schema.json#/$defs/ResponseEnvelope"
    }
  ],
  "properties": {
    "groupId": {
      "type": "string"
    },
    "groupName": {
      "type": "string"
    },
    "groupType": {
      "type": "string"
    },
    "customFields": {
      "type": [
        "array",
        "null"
      ],
      "items": {
        "$ref": "../../common.schema.json#/$defs/FieldDefinition"
      }
    },
    "response_code": {
      "type": "string"
    },
    "response_ref_id": {
      "type": "string"
    },
    "response_code_desc": {
      "type": "string"
    }
  }
}
